29,15,AIMR,6,4,6,6,7,6,4,10,5,17,9,9,9,6,The AIMR System,The AIMR System,The AIMR System,The AIMR System,6,5,5,"I feel like it removes the friction between idea and writing, which slows down the brainstorming process",6,7,6,"Having the ideas be closer, some were randomly very far",Some ideas were registered a lot of times,6,Neutral,Very Satisfied,Neutral,Unsatisfied,Unsatisfied,Very Satisfied,Satisfied,It felt very natural to simply speak and get the system to register them without worrying about it,NA,NA
30,15,AIMR,6,7,7,5,6,3,8,14,9,14,8,6,9.833333333333334,5,Both,The AIMR System,The AIMR System,The AIMR System,7,5,5,NA,6,6,6,It was great,NA,6,Very unsatisfied,Very unsatisfied,Very unsatisfied,Very unsatisfied,Very unsatisfied,Very unsatisfied,Neutral,NA,NA,NA
31,16,Sticky notes,4,4,5,3,5,5,12,12,5,14,4,5,8.666666666666666,6,The AIMR System,The AIMR System,Sticky notes,The AIMR System,5,3,3,"I feel like the AI just focus on the content not combining with topic, so the generated gray bubbles are sometimes not correct",6,4,6,"Uiux, change the color after the bubbles are generated",Hard to brainstorm when I need to check the gray bubbles,5,Neutral,Satisfied,Neutral,Very Satisfied,Very Satisfied,Very Satisfied,Very Satisfied,Yes,NA,NA
32,16,Sticky notes,5,4,5,4,7,6,5,6,8,12,8,11,8.333333333333334,4,Both,Both,Both,The AIMR System,4,4,4,NA,5,3,5,need more guiding for new users,NA,6,Very Satisfied,Satisfied,Satisfied,Very Satisfied,Satisfied,Satisfied,Satisfied,nice ambient sound！,NA,NA
33,17,Sticky notes,6,7,7,7,7,4,11,11,15,8,11,4,10,4,Sticky notes,Sticky notes,Sticky notes,Sticky notes,4,3,3,It kept generating the same phrases over and over again,4,5,5,"I think that making both players be able to see the same categories would really help-- like see the same things, maybe both have their own dashboard and nodes but then connect them together and stuff",NA,5,Unsatisfied,Satisfied,Satisfied,Satisfied,Very Satisfied,Neutral,Satisfied,NA,NA,NA
34,17,Sticky notes,6,7,7,7,6,6,3,3,3,3,3,3,3,3,Sticky notes,Sticky notes,Sticky notes,Sticky notes,3,2,3,If the AIMR were able to offload and save the brainstorming it would be useful on the computer instead of copying sticky notes down. Seems promising!!,5,5,4,I think improving UI/UX components and functionality to offload data to a computer would be great!,difficult to control the nodes,2,Unsatisfied,Unsatisfied,Unsatisfied,Satisfied,Satisfied,Satisfied,Neutral,it was a fun exercise,NA,NA
